{
  "title": "Карточка героя (шаблон)",
  "$schema": "https://json-schema.org/draft/2020-12/schema",
  "type": "object",
  "properties": {
    "$schema": {
      "type": "string"
    },
    "$comment": {
      "type": "string"
    },
    "id": {
      "type": "string",
      "pattern": "^[a-z][a-z0-9_]*$"
    },
    "name": {
      "type": "string",
      "minLength": 1
    },
    "gender": {
      "type": "string",
      "enum": [
        "m",
        "f"
      ]
    },
    "job": {
      "type": "string",
      "pattern": "^[a-z][a-z0-9_]*$"
    },
    "line": {
      "type": "string",
      "pattern": "^[a-z][a-z0-9_]*$"
    },
    "role": {
      "type": "string",
      "enum": [
        "tank",
        "damage",
        "healer",
        "support"
      ]
    },
    "source": {
      "type": "string",
      "enum": [
        "story",
        "summon"
      ]
    },
    "baseRarity": {
      "type": "string",
      "enum": [
        "green",
        "blue",
        "purple",
        "gold",
        "red"
      ]
    },
    "maxRarity": {
      "type": "string",
      "enum": [
        "green",
        "blue",
        "purple",
        "gold",
        "red"
      ]
    },
    "statMods": {
      "default": {},
      "type": "object",
      "properties": {
        "hp": {
          "type": "number",
          "exclusiveMinimum": 0
        },
        "atk": {
          "type": "number",
          "exclusiveMinimum": 0
        },
        "def": {
          "type": "number",
          "exclusiveMinimum": 0
        },
        "spd": {
          "type": "number",
          "exclusiveMinimum": 0
        }
      }
    },
    "skills": {
      "minItems": 1,
      "type": "array",
      "items": {
        "type": "object",
        "properties": {
          "level": {
            "type": "integer",
            "exclusiveMinimum": 0,
            "maximum": 9007199254740991
          },
          "skill": {
            "type": "string",
            "pattern": "^[a-z][a-z0-9_]*$"
          }
        },
        "required": [
          "level",
          "skill"
        ]
      }
    },
    "ult": {
      "type": "string",
      "pattern": "^[a-z][a-z0-9_]*$"
    },
    "behavior": {
      "type": "string",
      "pattern": "^[a-z][a-z0-9_]*$"
    },
    "branches": {
      "minItems": 2,
      "maxItems": 2,
      "type": "array",
      "items": {
        "type": "object",
        "properties": {
          "job": {
            "type": "string",
            "pattern": "^[a-z][a-z0-9_]*$"
          },
          "role": {
            "type": "string",
            "enum": [
              "tank",
              "damage",
              "healer",
              "support"
            ]
          },
          "statMods": {
            "default": {},
            "type": "object",
            "properties": {
              "hp": {
                "type": "number",
                "exclusiveMinimum": 0
              },
              "atk": {
                "type": "number",
                "exclusiveMinimum": 0
              },
              "def": {
                "type": "number",
                "exclusiveMinimum": 0
              },
              "spd": {
                "type": "number",
                "exclusiveMinimum": 0
              }
            }
          },
          "skills": {
            "minItems": 1,
            "type": "array",
            "items": {
              "type": "object",
              "properties": {
                "level": {
                  "type": "integer",
                  "exclusiveMinimum": 0,
                  "maximum": 9007199254740991
                },
                "skill": {
                  "type": "string",
                  "pattern": "^[a-z][a-z0-9_]*$"
                }
              },
              "required": [
                "level",
                "skill"
              ]
            }
          },
          "ult": {
            "type": "string",
            "pattern": "^[a-z][a-z0-9_]*$"
          },
          "promotion": {
            "type": "string",
            "maxLength": 160
          },
          "bio": {
            "type": "string",
            "maxLength": 300
          },
          "visual": {
            "default": {},
            "type": "object",
            "properties": {
              "sprite": {
                "type": "string"
              }
            }
          },
          "behavior": {
            "type": "string",
            "pattern": "^[a-z][a-z0-9_]*$"
          }
        },
        "required": [
          "job",
          "role",
          "skills",
          "promotion"
        ]
      }
    },
    "visual": {
      "default": {},
      "type": "object",
      "properties": {
        "sprite": {
          "type": "string"
        },
        "portrait": {
          "type": "string"
        }
      }
    },
    "bio": {
      "type": "string",
      "maxLength": 160
    },
    "hook": {
      "type": "string",
      "maxLength": 200
    },
    "tavernLine": {
      "type": "string",
      "minLength": 1,
      "maxLength": 120
    },
    "ascendLines": {
      "type": "object",
      "properties": {
        "blue": {
          "type": "string",
          "minLength": 1,
          "maxLength": 120
        },
        "purple": {
          "type": "string",
          "minLength": 1,
          "maxLength": 120
        },
        "gold": {
          "type": "string",
          "minLength": 1,
          "maxLength": 120
        },
        "red": {
          "type": "string",
          "minLength": 1,
          "maxLength": 120
        }
      },
      "additionalProperties": false
    }
  },
  "required": [
    "id",
    "name",
    "gender",
    "job",
    "line",
    "role",
    "source",
    "baseRarity",
    "maxRarity",
    "skills",
    "branches",
    "bio",
    "hook"
  ]
}
