{
  "$schema": "../schema/hero.schema.json",
  "id": "zara",
  "name": "Зара",
  "gender": "f",
  "job": "thief",
  "line": "thief",
  "role": "damage",
  "source": "summon",
  "baseRarity": "green",
  "maxRarity": "red",
  "statMods": {
    "hp": 0.9,
    "atk": 1.1,
    "spd": 1.1
  },
  "skills": [
    {
      "level": 1,
      "skill": "job_thief_envenom"
    },
    {
      "level": 10,
      "skill": "job_thief_double_attack"
    },
    {
      "level": 30,
      "skill": "job_thief_venom_knife"
    },
    {
      "level": 50,
      "skill": "job_thief_improve_dodge"
    }
  ],
  "ult": "ult_zara_sand_attack",
  "branches": [
    {
      "job": "assassin",
      "role": "damage",
      "statMods": {
        "hp": 1.05,
        "atk": 1.35,
        "def": 1,
        "spd": 1.15
      },
      "skills": [
        {
          "level": 1,
          "skill": "job_assassin_grimtooth"
        },
        {
          "level": 10,
          "skill": "job_assassin_enchant_poison"
        },
        {
          "level": 30,
          "skill": "job_thief_venom_knife"
        },
        {
          "level": 50,
          "skill": "job_assassin_venom_splasher"
        }
      ],
      "ult": "ult_zara_sonic_blow",
      "promotion": "Зара возвращается в Моррок ассасином. Тот, кто её подставил, уже знает.",
      "bio": "Ассасин Моррока с ядом на каждом клинке. Зара вернулась туда, где её подставили, и имя предателя уже почти у неё в руках. Враги падают раньше, чем замечают её тень.",
      "visual": {
        "sprite": "assassin_f"
      }
    },
    {
      "job": "rogue",
      "role": "support",
      "statMods": {
        "hp": 1.15,
        "atk": 1.2,
        "def": 1.1
      },
      "skills": [
        {
          "level": 1,
          "skill": "job_rogue_back_stab"
        },
        {
          "level": 10,
          "skill": "job_rogue_gank"
        },
        {
          "level": 30,
          "skill": "job_thief_sand_attack"
        },
        {
          "level": 50,
          "skill": "job_rogue_strip_armor"
        }
      ],
      "ult": "ult_zara_strip_weapon",
      "promotion": "Зара учится отнимать у врага оружие и доспех, а не только кошелёк.",
      "bio": "Разбойница с большой дороги у Комодо: снимает с врага оружие и доспех, а заодно и боевой пыл. Зара выбирает хитрость вместо мести — пока. Тот, кто подставил её в Морроке, ещё услышит о ней.",
      "visual": {
        "sprite": "rogue_f"
      },
      "behavior": "assassin"
    }
  ],
  "bio": "Воровка с ядовитыми ножами из пустыни Сограт.",
  "hook": "Ищет того, кто подставил её в Морроке.",
  "tavernLine": "Нож у горла — не угроза, трактирщик. Это вопрос: где у тебя чёрный ход?",
  "ascendLines": {
    "blue": "Зара убирает нож от горла Брана на полсекунды раньше обычного. Бран записывает: прогресс.",
    "purple": "Зара отправляет в Моррок письмо без подписи. Внутри — один нож. Адресат поймёт.",
    "gold": "Дорн впервые видит, как Зара смеётся. Заре не нравится, что он видел. Дорн молчит — жить хочется.",
    "red": "Сет не спит третью ночь: под дверью каждое утро песок Сограта. Зара спит отлично."
  }
}
