{
  "$schema": "../schema/hero.schema.json",
  "id": "alan",
  "name": "Алан",
  "gender": "m",
  "job": "swordman",
  "line": "swordman",
  "role": "tank",
  "source": "story",
  "baseRarity": "green",
  "maxRarity": "red",
  "statMods": {
    "hp": 1.1,
    "atk": 0.9,
    "def": 1.15
  },
  "skills": [
    {
      "level": 1,
      "skill": "swordman_bash"
    },
    {
      "level": 10,
      "skill": "swordman_endure"
    },
    {
      "level": 30,
      "skill": "job_swordman_hp_recovery"
    },
    {
      "level": 50,
      "skill": "job_swordman_provoke"
    }
  ],
  "branches": [
    {
      "job": "knight",
      "role": "tank",
      "statMods": {
        "hp": 1.4,
        "atk": 1.1,
        "def": 1.45
      },
      "skills": [
        {
          "level": 1,
          "skill": "job_knight_bowling_bash"
        },
        {
          "level": 10,
          "skill": "job_swordman_provoke"
        },
        {
          "level": 30,
          "skill": "job_knight_auto_counter"
        },
        {
          "level": 50,
          "skill": "job_knight_parrying"
        }
      ],
      "promotion": "Капитан Гаррет молча протягивает Алану рыцарский щит Пронтеры: «Отступать научился. Теперь — вперёд».",
      "bio": "Рыцарь Пронтеры в тяжёлом доспехе. Бравады у Алана не убавилось, но теперь он знает, когда шагнуть назад, — и потому враг не может обойти строй. Гаррет держит его на правом фланге и больше не спорит.",
      "visual": {
        "sprite": "knight_m"
      }
    },
    {
      "job": "crusader",
      "role": "tank",
      "statMods": {
        "hp": 1.45,
        "atk": 1,
        "def": 1.4
      },
      "skills": [
        {
          "level": 1,
          "skill": "job_crusader_devotion"
        },
        {
          "level": 10,
          "skill": "job_crusader_faith"
        },
        {
          "level": 30,
          "skill": "job_crusader_auto_guard"
        },
        {
          "level": 50,
          "skill": "job_crusader_defender"
        }
      ],
      "promotion": "Орден Креста принимает Алана: щит теперь закрывает не только его самого.",
      "bio": "Крестоносец, давший обет щита. Алан по-прежнему встаёт первым, но уже не ради славы: святая сила ордена переносит на него удары, предназначенные товарищам. Капитан Гаррет, узнав, лишь хмыкнул: «Отступать так и не научился».",
      "visual": {
        "sprite": "crusader_m"
      }
    }
  ],
  "visual": {
    "sprite": "hero_alan_swordman"
  },
  "bio": "Мечник из деревни у Пронтеры. Щит, бравада и привычка вставать первым.",
  "hook": "Хочет в рыцари Пронтеры, а капитан Гаррет не берёт — «пока не научишься отступать»."
}
