{
  "$schema": "../schema/hero.schema.json",
  "id": "iris",
  "name": "Ирис",
  "gender": "f",
  "job": "swordman",
  "line": "swordman",
  "role": "damage",
  "source": "summon",
  "baseRarity": "green",
  "maxRarity": "red",
  "statMods": {
    "hp": 0.9,
    "atk": 1.25,
    "def": 0.75,
    "spd": 1.05
  },
  "skills": [
    {
      "level": 1,
      "skill": "job_swordman_magnum_break"
    },
    {
      "level": 10,
      "skill": "job_knight_two_hand_mastery"
    },
    {
      "level": 30,
      "skill": "swordman_bash"
    },
    {
      "level": 50,
      "skill": "job_swordman_auto_berserk"
    }
  ],
  "branches": [
    {
      "job": "knight",
      "role": "damage",
      "statMods": {
        "hp": 1.15,
        "atk": 1.35,
        "def": 1.05,
        "spd": 1.05
      },
      "skills": [
        {
          "level": 1,
          "skill": "job_knight_charge_attack"
        },
        {
          "level": 10,
          "skill": "job_knight_two_hand_quicken"
        },
        {
          "level": 30,
          "skill": "job_knight_two_hand_mastery"
        },
        {
          "level": 50,
          "skill": "job_knight_spiral_pierce"
        }
      ],
      "promotion": "Ирис берёт двуручник рыцаря Пронтеры. Щит ей по-прежнему не нужен.",
      "bio": "Рыцарь Пронтеры с двуручным мечом и без щита — устав ордена этого не одобряет, но и не запрещает. Ирис рубит строй врага широкими взмахами и первой прорывается к раненым. Бывшие братья по ордену говорят о ней уже с уважением.",
      "visual": {
        "sprite": "knight_f"
      }
    },
    {
      "job": "crusader",
      "role": "tank",
      "statMods": {
        "hp": 1.35,
        "atk": 1.15,
        "def": 1.3
      },
      "skills": [
        {
          "level": 1,
          "skill": "job_crusader_holy_cross"
        },
        {
          "level": 10,
          "skill": "job_crusader_shield_charge"
        },
        {
          "level": 30,
          "skill": "job_crusader_faith"
        },
        {
          "level": 50,
          "skill": "job_crusader_grand_cross"
        }
      ],
      "promotion": "Орден, изгнавший Ирис, зовёт её обратно — теперь щитом для всех.",
      "bio": "Крестоносец, вернувшаяся в орден, который её изгнал. Щит Ирис снова взяла в руки — не для себя, а чтобы закрыть им всех, кого когда-то выносила на плечах. Святой свет ордена теперь служит её собственному правилу: раненых не бросают.",
      "visual": {
        "sprite": "crusader_f"
      }
    }
  ],
  "bio": "Мечница с двуручником. Щит считает лишним весом.",
  "hook": "Изгнана из ордена Пронтеры: бросила щит, чтобы вынести раненых."
}
