{
  "$schema": "../schema/hero.schema.json",
  "id": "bran",
  "name": "Бран",
  "gender": "m",
  "job": "archer",
  "line": "archer",
  "role": "damage",
  "source": "story",
  "baseRarity": "green",
  "maxRarity": "red",
  "statMods": {},
  "skills": [
    {
      "level": 1,
      "skill": "job_archer_double_strafe"
    },
    {
      "level": 10,
      "skill": "job_archer_owls_eye"
    },
    {
      "level": 30,
      "skill": "job_archer_vultures_eye"
    },
    {
      "level": 50,
      "skill": "job_archer_charge_arrow"
    }
  ],
  "branches": [
    {
      "job": "hunter",
      "role": "damage",
      "statMods": {
        "hp": 1.2,
        "atk": 1.3,
        "def": 1.15
      },
      "skills": [
        {
          "level": 1,
          "skill": "job_hunter_blitz_beat"
        },
        {
          "level": 10,
          "skill": "job_hunter_beast_bane"
        },
        {
          "level": 30,
          "skill": "job_hunter_steel_crow"
        },
        {
          "level": 50,
          "skill": "job_hunter_falcon_assault"
        }
      ],
      "promotion": "Гильдия охотников Хьюджела принимает Брана. Первым делом он заводит сокола — и новую тетрадь долгов.",
      "visual": {
        "sprite": "hunter_m"
      }
    },
    {
      "job": "bard",
      "role": "support",
      "statMods": {
        "hp": 1.2,
        "atk": 1.15,
        "def": 1.15
      },
      "skills": [
        {
          "level": 1,
          "skill": "job_bard_musical_strike"
        },
        {
          "level": 10,
          "skill": "job_bard_poem_of_bragi"
        },
        {
          "level": 30,
          "skill": "job_bard_apple_of_idun"
        },
        {
          "level": 50,
          "skill": "job_bard_assassin_cross"
        }
      ],
      "promotion": "Бран впервые поёт при всех. Долги Алана теперь в стихах.",
      "visual": {
        "sprite": "bard_m"
      }
    }
  ],
  "bio": "Лучник-скептик: бьёт одну цель, но наверняка.",
  "hook": "Ведёт счёт долгов Алана «на потом» — и однажды предъявит.",
  "visual": {
    "sprite": "hero_bran_archer"
  }
}
